{
  "schema": "execution-policy-decision-v1",
  "decision_id": "decision-1",
  "run_id": "run-1",
  "stage_id": "stage-1",
  "context_sha256": "bbbbbbbbbbbbbbbbbbbbbbbbbbbbbbbbbbbbbbbbbbbbbbbbbbbbbbbbbbbbbbbb",
  "provider": {
    "provider_id": "jinny-android-practices",
    "provider_version": "1.0.0",
    "provider_manifest_sha256": "aaaaaaaaaaaaaaaaaaaaaaaaaaaaaaaaaaaaaaaaaaaaaaaaaaaaaaaaaaaaaaaa",
    "skill_id": "jinny-android-execution-policy",
    "skill_version": "1.0.0"
  },
  "outcome": {
    "type": "delegate",
    "worker_profile_id": "analysis-reader",
    "task_class": "analysis",
    "requested_effect": "read_only",
    "reason_codes": ["bounded-task"],
    "independent_review_requested": false
  },
  "created_at": "2026-09-01T00:00:00Z"
}
